{
  "kind": "controlled_agent_recovery_matrix",
  "version": "2026-07-08",
  "authority": "recovery_matrix_metadata",
  "cloudRequired": false,
  "executionAllowed": false,
  "implementationAdded": false,
  "matrixId": "recovery-matrix-s120-stop",
  "scope": {
    "hostSurface": "jetbrains",
    "docsOnly": true,
    "runtimeMutationAllowed": false,
    "backendRequired": false,
    "productionClaimAllowed": false,
    "summary": "Docs contract for stopped and unsupported display states"
  },
  "policyFlags": {
    "userVisibleStateRequired": true,
    "manualActionRequiredForRetry": true,
    "hiddenRetryAllowed": false,
    "automaticRollbackAllowed": false,
    "hiddenRepairAllowed": false,
    "unboundedRepairAllowed": false,
    "rawOutputPersistenceAllowed": false,
    "privatePathPersistenceAllowed": false,
    "secretPersistenceAllowed": false,
    "staleResultAccepted": false,
    "unsupportedHostClaimsSupport": false,
    "productionClaimAllowed": false,
    "releaseClaimAllowed": false
  },
  "states": [
    {
      "stateId": "stop-requested",
      "userVisibleState": "stop_requested",
      "category": "stop",
      "terminal": false,
      "resultAccepted": false,
      "hostSupportClaimed": false,
      "attemptBudget": {
        "maxAttempts": 0,
        "attemptsUsed": 0,
        "moreAttemptsAllowed": false,
        "requiresUserConfirmation": true
      },
      "allowedNextActions": [
        "acknowledge",
        "open_safe_summary"
      ],
      "forbiddenActions": [
        "hidden_retry",
        "auto_rollback",
        "hidden_repair",
        "accept_stale_result",
        "persist_raw_output",
        "persist_private_path",
        "persist_secret",
        "unbounded_attempts",
        "claim_unsupported_host_support",
        "mutate_workspace"
      ],
      "privacy": {
        "sanitizedOnly": true,
        "rawOutputStored": false,
        "privatePathStored": false,
        "secretStored": false,
        "note": "Safe status labels only"
      },
      "summary": "Stop is visible while the current run winds down"
    },
    {
      "stateId": "stop-completed",
      "userVisibleState": "stop_completed",
      "category": "stop",
      "terminal": true,
      "resultAccepted": false,
      "hostSupportClaimed": false,
      "attemptBudget": {
        "maxAttempts": 0,
        "attemptsUsed": 0,
        "moreAttemptsAllowed": false,
        "requiresUserConfirmation": true
      },
      "allowedNextActions": [
        "acknowledge",
        "start_new_run",
        "dismiss"
      ],
      "forbiddenActions": [
        "hidden_retry",
        "auto_rollback",
        "hidden_repair",
        "accept_stale_result",
        "persist_raw_output",
        "persist_private_path",
        "persist_secret",
        "unbounded_attempts",
        "claim_unsupported_host_support",
        "mutate_workspace"
      ],
      "privacy": {
        "sanitizedOnly": true,
        "rawOutputStored": false,
        "privatePathStored": false,
        "secretStored": false,
        "note": "Safe status labels only"
      },
      "summary": "Stopped run is closed until the user starts a new run"
    },
    {
      "stateId": "stale-duplicate-result",
      "userVisibleState": "stale_duplicate_result",
      "category": "stale",
      "terminal": true,
      "resultAccepted": false,
      "hostSupportClaimed": false,
      "attemptBudget": {
        "maxAttempts": 0,
        "attemptsUsed": 0,
        "moreAttemptsAllowed": false,
        "requiresUserConfirmation": true
      },
      "allowedNextActions": [
        "acknowledge",
        "start_new_run",
        "open_safe_summary"
      ],
      "forbiddenActions": [
        "hidden_retry",
        "auto_rollback",
        "hidden_repair",
        "accept_stale_result",
        "persist_raw_output",
        "persist_private_path",
        "persist_secret",
        "unbounded_attempts",
        "claim_unsupported_host_support",
        "mutate_workspace"
      ],
      "privacy": {
        "sanitizedOnly": true,
        "rawOutputStored": false,
        "privatePathStored": false,
        "secretStored": false,
        "note": "Safe status labels only"
      },
      "summary": "Old duplicate result is displayed as ignored evidence"
    },
    {
      "stateId": "host-disconnect-runtime-restart",
      "userVisibleState": "host_disconnect_runtime_restart",
      "category": "disconnect",
      "terminal": false,
      "resultAccepted": false,
      "hostSupportClaimed": false,
      "attemptBudget": {
        "maxAttempts": 1,
        "attemptsUsed": 0,
        "moreAttemptsAllowed": true,
        "requiresUserConfirmation": true
      },
      "allowedNextActions": [
        "request_user_choice",
        "manual_retry",
        "start_new_run"
      ],
      "forbiddenActions": [
        "hidden_retry",
        "auto_rollback",
        "hidden_repair",
        "accept_stale_result",
        "persist_raw_output",
        "persist_private_path",
        "persist_secret",
        "unbounded_attempts",
        "claim_unsupported_host_support",
        "mutate_workspace"
      ],
      "privacy": {
        "sanitizedOnly": true,
        "rawOutputStored": false,
        "privatePathStored": false,
        "secretStored": false,
        "note": "Safe status labels only"
      },
      "summary": "Disconnected host can resume only after a user choice"
    },
    {
      "stateId": "provider-timeout",
      "userVisibleState": "provider_timeout",
      "category": "timeout",
      "terminal": false,
      "resultAccepted": false,
      "hostSupportClaimed": false,
      "attemptBudget": {
        "maxAttempts": 1,
        "attemptsUsed": 1,
        "moreAttemptsAllowed": false,
        "requiresUserConfirmation": true
      },
      "allowedNextActions": [
        "acknowledge",
        "manual_retry",
        "start_new_run"
      ],
      "forbiddenActions": [
        "hidden_retry",
        "auto_rollback",
        "hidden_repair",
        "accept_stale_result",
        "persist_raw_output",
        "persist_private_path",
        "persist_secret",
        "unbounded_attempts",
        "claim_unsupported_host_support",
        "mutate_workspace"
      ],
      "privacy": {
        "sanitizedOnly": true,
        "rawOutputStored": false,
        "privatePathStored": false,
        "secretStored": false,
        "note": "Safe status labels only"
      },
      "summary": "Timed out model response needs a visible user choice"
    },
    {
      "stateId": "edit-hash-mismatch",
      "userVisibleState": "edit_hash_mismatch",
      "category": "edit_mismatch",
      "terminal": true,
      "resultAccepted": false,
      "hostSupportClaimed": false,
      "attemptBudget": {
        "maxAttempts": 0,
        "attemptsUsed": 0,
        "moreAttemptsAllowed": false,
        "requiresUserConfirmation": true
      },
      "allowedNextActions": [
        "acknowledge",
        "start_new_run",
        "open_safe_summary"
      ],
      "forbiddenActions": [
        "hidden_retry",
        "auto_rollback",
        "hidden_repair",
        "accept_stale_result",
        "persist_raw_output",
        "persist_private_path",
        "persist_secret",
        "unbounded_attempts",
        "claim_unsupported_host_support",
        "mutate_workspace"
      ],
      "privacy": {
        "sanitizedOnly": true,
        "rawOutputStored": false,
        "privatePathStored": false,
        "secretStored": false,
        "note": "Safe status labels only"
      },
      "summary": "Edit mismatch blocks apply and keeps safe evidence only"
    },
    {
      "stateId": "verification-bundle-failure",
      "userVisibleState": "verification_bundle_failure",
      "category": "verification_failure",
      "terminal": false,
      "resultAccepted": false,
      "hostSupportClaimed": false,
      "attemptBudget": {
        "maxAttempts": 1,
        "attemptsUsed": 1,
        "moreAttemptsAllowed": false,
        "requiresUserConfirmation": true
      },
      "allowedNextActions": [
        "acknowledge",
        "manual_retry",
        "start_new_run",
        "open_safe_summary"
      ],
      "forbiddenActions": [
        "hidden_retry",
        "auto_rollback",
        "hidden_repair",
        "accept_stale_result",
        "persist_raw_output",
        "persist_private_path",
        "persist_secret",
        "unbounded_attempts",
        "claim_unsupported_host_support",
        "mutate_workspace"
      ],
      "privacy": {
        "sanitizedOnly": true,
        "rawOutputStored": false,
        "privatePathStored": false,
        "secretStored": false,
        "note": "Safe status labels only"
      },
      "summary": "Failed verification bundle allows only visible bounded choices"
    },
    {
      "stateId": "repair-followup-exhausted",
      "userVisibleState": "repair_followup_exhausted",
      "category": "repair_exhausted",
      "terminal": true,
      "resultAccepted": false,
      "hostSupportClaimed": false,
      "attemptBudget": {
        "maxAttempts": 1,
        "attemptsUsed": 1,
        "moreAttemptsAllowed": false,
        "requiresUserConfirmation": true
      },
      "allowedNextActions": [
        "acknowledge",
        "start_new_run",
        "open_safe_summary"
      ],
      "forbiddenActions": [
        "hidden_retry",
        "auto_rollback",
        "hidden_repair",
        "accept_stale_result",
        "persist_raw_output",
        "persist_private_path",
        "persist_secret",
        "unbounded_attempts",
        "claim_unsupported_host_support",
        "mutate_workspace"
      ],
      "privacy": {
        "sanitizedOnly": true,
        "rawOutputStored": false,
        "privatePathStored": false,
        "secretStored": false,
        "note": "Safe status labels only"
      },
      "summary": "Repair budget is spent and the run waits for a new user start"
    },
    {
      "stateId": "checkpoint-rollback-review",